{"failure":null,"invocationDigest":"86010216dbb616e3788d77ba6edc6d22f6960906fe11274297cda09e0a068545","outcome":{"kind":"operand","operand":{"digest":"c9c212bc6a0b55b0da7101bded2bb9f1c182b1e041f4d49c1649c2c841c500f2","role":"oracle-operand"}},"resultId":"c927c451b988f8159a2c4ac4e41e29c73b5f0ae29e9ccc4c19eb673a2c6553e0","schemaVersion":1}