{"failure":null,"invocationDigest":"7fad6c2e41aff33ec7a7b177685d7c67181ff6f4a682083946b5af2121f915b7","outcome":{"kind":"operand","operand":{"digest":"daa178a6814c46b2692cd3601e2bdb9f5e4cb0e769aa3ef8f084df2d37b4e0c2","role":"oracle-operand"}},"resultId":"1927ec43744a73900bdc2770969b6b26afafd9a8dd7d2edd58e137f4a8bc1225","schemaVersion":1}