{
  "schemaVersion": 1,
  "resultId": "2f968dc3f8dd3adc73fb6039dc355c35e31c6e6aef446d455fe7500d50c27fed",
  "invocationDigest": "5f34508e21ef4948b568f0a28256512ca289371f962f5a2d564f0cee80ae98c0",
  "outcome": {
    "kind": "operand",
    "operand": {
      "role": "oracle-operand",
      "digest": "435a3976c50c828f092b99b42ae0c7b3a0881bc37cfd5034771b37ead6045897"
    }
  },
  "failure": null
}
