{"failure":null,"invocationDigest":"c0fe7f59974e055954d86389cadb9ce6688d497a3a39eae8b1371abacfc467de","outcome":{"kind":"operand","operand":{"digest":"733839250ace664429b8754e0251ad579409948c173555b15cd307f302cbd1c9","role":"oracle-operand"}},"resultId":"08b3218d83e841de35c5639db010077a001c6d0a8e6fff4210c9fbdf64512d16","schemaVersion":1}